state pension	1000000	2.84	13	informational
basic state pension	1000000	2.84	18	informational
women against state pension inequality	110000	1.17	10	informational
uk state pension news	110000	1.86	43	informational
state pension news	110000	1.86	6	informational
news on state pension	110000	1.86	6	informational
uk state pension age retirement changes	90500	3.19	10	informational
uk state pension age	90500	1.99	25	informational
state pension what age	90500	1.99	29	informational
state pension uk age	90500	1.99	43	informational
state pension retirement age	90500	1.99	34	informational
state pension age	90500	1.99	35	informational
basic state pension age	90500	1.99	35	informational
age uk state pension	90500	1.99	37	informational
age of state pension uk	90500	1.99	36	informational
age for state pension uk	90500	1.99	40	informational
age for state pension in uk	90500	1.99	29	informational
age for state pension	90500	1.99	35	informational
uk state pension how much	60500	1.23	37	informational
state pension uk how much	60500	1.23	37	informational
state pension increase 2025	60500	1.23	17	informational
state pension in uk how much	60500	1.23	37	informational
state pension how much	60500	1.23	36	informational
how much uk state pension	60500	1.23	37	informational
how much the state pension	60500	1.23	36	informational
how much state pension uk	60500	1.23	37	informational
how much state pension in uk	60500	1.23	37	informational
how much state pension	60500	1.23	36	informational
how much is uk state pension	60500	1.23	37	informational
how much is u k state pension	60500	1.23	36	informational
how much is the uk state pension	60500	1.23	37	informational
how much is the state pension uk	60500	1.23	36	informational
how much is the state pension in uk	60500	1.23	37	informational
how much is the basic state pension	60500	1.23	35	informational
how much is state pension uk	60500	1.23	37	informational
how much is state pension in uk	60500	1.23	37	informational
how much is state pension	60500	1.23	37	informational
how much is basic state pension	60500	1.23	16	informational
how much is a uk state pension	60500	1.23	37	informational
how much is a state pension uk	60500	1.23	37	informational
how much is a state pension	60500	1.23	37	informational
how much is a basic state pension	60500	1.23	22	informational
how much for state pension	60500	1.23	36	informational
how much basic state pension	60500	1.23	37	informational
uk state pension checker	49500	3.14	43	navigational
state pension checker	49500	3.14	39	navigational
state pension check	49500	3.14	37	informational
check your state pension	49500	3.14	40	informational
check state pension	49500	3.14	37	informational
check my state pension	49500	3.14	38	informational
uk state pension forecast	40500	3.67	35	informational
uk state pension amount	40500	0.63	35	informational
state pension uk rates	40500	0.63	37	informational
state pension uk amount	40500	0.63	35	informational
state pension rates	40500	0.63	35	informational
state pension rate	40500	0.63	35	informational
state pension projection	40500	3.67	21	informational
state pension in uk amount	40500	0.63	35	informational
state pension forecast	40500	3.67	21	informational
state pension amounts	40500	0.63	37	informational
state pension amount	40500	0.63	38	informational
my state pension forecast	40500	3.67	27	informational
forecast state pension	40500	3.67	21	informational
forecast of state pension	40500	3.67	21	informational
forecast my state pension	40500	3.67	36	informational
forecast for state pension	40500	3.67	25	informational
basic state pension amount	40500	0.63	0	informational
amount state pension uk	40500	0.63	35	informational
amount state pension	40500	0.63	38	informational
amount of state pension uk	40500	0.63	35	informational
uk state pension increases	27100	0.43	7	informational
uk state pension increase	27100	0.43	7	informational
uk state pension age increase	27100	2.95	21	informational
state pension uk increase	27100	0.43	7	informational
state pension to rise	27100	0.43	20	informational
state pension to increase	27100	0.43	14	informational
state pension increases	27100	0.43	15	informational
state pension increase	27100	0.43	14	informational
state pension age to rise	27100	2.95	11	informational
state pension age rise	27100	2.95	14	informational
state pension age review	27100	0	15	informational
state pension age increase	27100	2.95	14	informational
rise in state pension age	27100	2.95	14	informational
review of state pension age	27100	0	5	informational
increase state pension age	27100	2.95	14	informational
increase state pension	27100	0.43	14	informational
increase in uk state pension	27100	0.43	15	informational
increase in state pension age	27100	2.95	14	informational
increase in state pension	27100	0.43	14	informational
how much state pension will i get at 66	27100	2.29	37	informational
dwp state pension back payments	27100	0	10	informational
uk state pension calculator	22200	1.71	48	informational
uk state pension calculation	22200	1.71	47	informational
uk state pension age change 2025	22200	2.03	12	informational
state pension in uk calculator	22200	1.71	47	informational
state pension calculator uk	22200	1.71	47	navigational
state pension calculator england	22200	1.71	48	informational
state pension calculation uk	22200	1.71	47	informational
calculate state pension uk	22200	1.71	47	informational
british state pension calculator	22200	1.71	48	informational
when will i get my state pension	18100	0.47	40	informational
when do i get my uk state pension	18100	0.47	40	informational
when do i get my state pension	18100	0.47	40	informational
when can i get my state pension uk	18100	0.47	41	informational
when can i get my state pension	18100	0.47	36	informational
when can get my state pension	18100	0.47	41	informational
united kingdom state pension	18100	3.83	37	informational
uk state pension	18100	3.83	43	informational
u k state pension	18100	3.83	42	informational
state pension martin lewis	18100	2.68	14	informational
state pension in uk	18100	3.83	30	informational
state pension england	18100	3.83	53	informational
state pension 2025	18100	1.21	22	informational
martin lewis state pension	18100	2.68	15	informational
english state pension	18100	3.83	37	informational
british state pension	18100	3.83	35	informational
basic state pension uk	18100	3.83	23	informational
uk state pension triple lock	14800	3.03	23	informational
uk state pension age increase 2026	14800	0	24	informational
uk state pension age changes	14800	2.39	17	informational
uk state pension age calculator	14800	1.11	35	informational
triple lock state pension	14800	3.03	22	informational
triple lock on state pension	14800	3.03	22	informational
state pension united kingdom	14800	2.38	36	informational
state pension uk	14800	2.38	35	informational
state pension triple lock	14800	3.03	1	informational
state pension to be means tested	14800	0	7	informational
state pension means-testing	14800	0	9	informational
state pension means-tested	14800	0	27	informational
state pension means testing	14800	0	8	informational
state pension means tested	14800	0	8	informational
state pension means test	14800	0	7	informational
state pension calculator age	14800	1.11	43	informational
state pension age increase 2026	14800	0	17	informational
state pension age changing	14800	2.39	21	informational
state pension age changes	14800	2.39	21	informational
state pension age change	14800	2.39	22	informational
state pension age calculator	14800	1.11	30	informational
state pension age calculation	14800	1.11	38	informational
new state pension uk	14800	1.53	39	informational
new state pension	14800	1.53	22	informational
means-testing state pension uk	14800	0	4	informational
means-testing state pension	14800	0	7	informational
means-tested state pension uk	14800	0	18	informational
means-tested state pension	14800	0	3	informational
means testing state pension uk	14800	0	21	informational
means testing state pension	14800	0	8	informational
how much is the state pension	14800	1.23	38	informational
dwp state pension changes next year	14800	0	31	informational
changes to uk state pension age	14800	2.39	21	informational
changes in state pension age	14800	2.39	21	informational
calculator for state pension age	14800	1.11	43	informational
calculate state pension age	14800	1.11	43	informational
age calculator for state pension	14800	1.11	43	informational
uk state pension news today	12100	2.5	19	navigational
state pension dwp	12100	5.06	19	informational
dwp state pension	12100	5.06	22	informational
www gov uk get state pension	9900	7.25	38	navigational
what is uk state pension age	9900	0.31	40	informational
what is the state pension age	9900	0.31	25	informational
what is state pension age	9900	0.31	25	informational
what is a state pension age	9900	0.31	25	informational
what age state pension uk	9900	0.31	36	informational
what age is state pension uk	9900	0.31	39	informational
what age is state pension in uk	9900	0.31	40	informational
what age is state pension	9900	0.31	35	informational
what age for state pension in uk	9900	0.31	37	informational
uk basic state pension	9900	6.66	0	informational
state pension today	9900	1.42	37	informational
state pension scheme uk	9900	6.66	31	informational
state pension scheme	9900	6.66	32	informational
state pension retirement age uk	9900	2.8	34	informational
state pension ages uk	9900	2.8	24	informational
state pension age uk	9900	2.8	35	informational
new state pension retirement age	9900	5.12	22	informational
new state pension ages	9900	5.12	23	informational
new state pension age	9900	5.12	21	informational
how much is the full state pension	9900	0.3	35	informational
how much is the full basic state pension	9900	0.3	18	commercial
how much is full state pension uk	9900	0.3	35	informational
how much is full state pension	9900	0.3	35	informational
how much is a full state pension	9900	0.3	35	informational
how much is a full basic state pension	9900	0.3	18	commercial
how much full state pension	9900	0.3	35	informational
full state pension 2025	9900	0.36	20	informational
dwp state pension underpayment	9900	0	7	informational
current uk state pension	9900	1.42	20	informational
current state pension uk	9900	1.42	20	informational
current state pension	9900	1.42	37	informational
what is the state pension amount	8100	0.46	37	informational
what is a state pension	8100	0.1	18	informational
state pension uk calculator	6600	2.26	47	informational
state pension calculator	6600	2.26	42	informational
calculator for state pension	6600	2.26	41	informational
basic state pension calculator	6600	2.26	42	informational
state pension age increase uk	2900	1.84	13	informational
uk state pension age women	2400	0	35	informational
uk state pension age table	2400	0.55	23	informational
uk state pension age for females	2400	0	29	informational
state pension age review uk	1900	0	14	informational
ni contributions for state pension	1600	1.54	39	informational
ni contributions and state pension	1600	1.54	34	informational
what age do you get state pension uk	1300	0.17	39	informational
state pension age changes uk	1300	2.5	35	informational
state pension age change uk	1300	2.5	22	informational
uk state pension deferral calculator	1000	0.92	13	informational
uk state pension age review	1000	0.04	16	informational
state pension deferral calculator	1000	0.92	16	informational
deferring state pension calculator	1000	0.92	1	informational
deferred state pension calculator	1000	0.92	14	informational
defer state pension calculator	1000	0.92	14	informational
uk state pension retirement age	880	2.66	41	informational
state pension for a couple	880	0.02	37	informational
state pension age in uk	880	2.66	35	informational
state pension age in the uk	880	2.66	35	informational
new state pension increase	880	0.06	19	informational
gov uk state pension age	880	4.92	46	informational
dwp state pension age change uk	880	0	15	informational
what is state pension age uk	720	0.02	35	informational
state pension contributions uk	720	0	38	informational
state pension contributions	720	0	37	informational
what is the current uk state pension age	590	0	38	informational
state pension statement	590	0	23	informational
state pension national insurance contributions	590	1.23	38	informational
national insurance contributions state pension	590	1.23	39	informational
what is state pension age in uk	480	0	35	informational
state pension inheritance	480	0	3	informational
state pension age calculator uk	480	1.28	35	informational
new state pension changes april	480	0	35	informational
national insurance contributions for state pension	390	0	41	informational
national insurance contributions and state pension	390	0	38	informational
check my state pension contributions	390	0.8	29	informational
state pension age rise uk	320	0	16	informational
state pension 26 27	260	0	12	informational
state pension payment days	210	0	2	informational
state pension pay days	210	0	0	informational
state pension budget	210	0	0	informational
state pension age uk 2025	210	3.1	26	informational
state pension 23/24	210	0	35	informational
underpaid state pension for someone who has died	170	0	3	informational
uk state pension age 71	170	0	26	informational
uk state pension age 68	170	0	0	informational
state pension and private pension	170	2.39	5	informational
state pension age uk female	170	0	26	informational
state pension age uk changes	170	0	15	informational
state pension age men uk	170	0	25	informational
state pension age for females in uk	170	0	22	informational
state pension age for female uk	170	0	26	informational
new state pension age uk	170	0	35	informational
women's state pension age uk	140	0	28	informational
state pension age woman uk	140	0	25	informational
retirement age for state pension uk	140	0	35	informational
does uk state pension increase at age 80	140	0	8	informational
current state pension age uk	140	0	35	informational
workplace pension vs state pension	110	0	8	informational
uk state pension age change 2025 latest news	110	0	12	informational
uk state pension age change 2025 gov uk	110	0	35	informational
state pension vs workplace pension	110	0	10	informational
state pension age increase to 68 gov uk	110	0	25	informational
do teachers get state pension as well uk	110	0	0	informational
changes to state pension age uk	110	0	12	informational
drawdown calculator including state pension	90	1.25	6	informational
uk new state pension age	70	0	17	informational
state pension underpayments older women	70	0	0	informational
state pension basic rate	70	0.02	35	informational
state pension age uk men	70	0	35	informational
state pension age timetable uk	70	0	21	informational
do you get civil service pension and state pension	70	0	9	informational
what is my state pension age uk	50	0	37	informational
state pension inheritance boost gov uk	50	0	26	informational
state pension age uk woman	50	0	35	informational
state pension age uk for women	50	0	35	informational
state pension age 2025 gov uk	50	0	35	informational
what age is state pension age in uk	40	0	40	informational
uk state pension age change 2025 calculator	40	0	0	informational
state pension age uk table	40	0	23	informational
state pension age uk male	40	0	21	informational
state pension age uk increase	40	0	0	informational
gov uk check state pension age	40	0	26	informational
australian state pension means test	40	0	5	informational
state pension check gov	30	0	0	navigational
new state pension vs old state pension	30	0	0	informational
check state pension years	30	0	39	informational
state pension deduction final salary	20	0	45	informational
reform policy on state pension	20	0	0	informational
new state pension contracted out	20	0	0	informational
deferring new state pension	20	0	0	informational
category b state pension	20	0	0	informational
can i pay my state pension into a sipp	20	0	0	informational
bereavement state pension	20	0	20	informational
will inheritance affect my state pension	10	0	0	informational
uk state pension gibraltar	10	0	0	informational
to claim state pension	10	0	16	informational
teachers pension and state pension	10	0	15	informational
state pension review 2022	10	0	42	informational
state pension review 2017	10	0	0	informational
state pension inheritance rules uk	10	0	11	informational
state pension inheritance calculator	10	0	0	informational
state pension increase 2017/18	10	0	0	informational
state pension gb news	10	0	0	informational
state pension for male	10	0	0	informational
state pension budget 2021	10	0	36	informational
state pension budget 2020	10	0	0	informational
state pension and military pension	10	0	0	informational
state pension amount 2018	10	0	0	informational
state pension 5th april	10	0	0	informational
state pension 2018 19	10	0	0	informational
state pension 10 qualifying years	10	0	0	informational
new state pension winners and losers	10	0	0	informational
new state pension for couples	10	0	0	informational
new state pension and serps	10	0	0	informational
minimum state pension spain	10	0	0	informational
inheritance boost state pension	10	0	0	informational
does inheritance affect state pension	10	0	0	informational
claim state pension by post	10	0	0	informational
check state pension underpayment	10	0	0	informational
check state pension pot	10	0	21	informational
basic state pension 2018/19	10	0	47	informational
auto enrolment reaching state pension age	10	0	0	informational
auto enrolment over state pension age	10	0	24	informational
